{"$id":"https://martin-beck.github.io/agent-workflow-quality/schemas/lifecycle-model.schema.json","$schema":"https://json-schema.org/draft/2020-12/schema","additionalProperties":false,"properties":{"assumptions":{"const":["atomic-abstract-actions","bounded-logical-time","bounded-monotonic-revisions","honest-distinct-reviewers","independent-components","single-atomic-durable-publication","staging-is-not-publication"]},"bounds":{"additionalProperties":false,"properties":{"max_states":{"maximum":20000,"minimum":1,"type":"integer"},"revisions":{"maximum":3,"minimum":1,"type":"integer"},"rollback_deadline":{"maximum":3,"minimum":1,"type":"integer"},"ticks":{"maximum":3,"minimum":1,"type":"integer"},"tiers":{"maximum":2,"minimum":1,"type":"integer"},"ttl":{"maximum":3,"minimum":1,"type":"integer"}},"required":["ticks","revisions","ttl","tiers","rollback_deadline","max_states"],"type":"object"},"kind":{"const":"model"},"model":{"const":"policy-lifecycle-v1"},"mutation":{"enum":["none","exception-expiry","stale-renewal","stale-review","review-quorum","stale-evidence","tier-skip","late-rollback","lost-update","torn-publication","restart-uncommitted"]},"schema_version":{"const":1}},"required":["schema_version","kind","model","mutation","assumptions","bounds"],"title":"AWQ bounded lifecycle model v1","type":"object"}
