{"assumptions":["atomic-abstract-actions","bounded-logical-time","bounded-monotonic-revisions","honest-distinct-reviewers","independent-components","single-atomic-durable-publication","staging-is-not-publication"],"bounds":{"max_states":20000,"revisions":2,"rollback_deadline":2,"ticks":2,"tiers":2,"ttl":1},"kind":"model","model":"policy-lifecycle-v1","mutation":"stale-renewal","schema_version":1}
